スポーツクラブＮＡＳ札幌,北海道札幌市西区西町南６丁目１−１,011-667-7711,スイミングスクール
アイアンジム（ＩＲＯＮＧＹＭ）,北海道札幌市東区北２０条東９丁目２−５,011-752-0808,スポーツクラブ
卓球ＨＯＵＳＥアラキ,北海道苫小牧市明野新町１丁目４−２,0144-57-2215,スポーツ教室
北見市役所　北地区市民トレーニングセンター,北海道北見市高栄東町４丁目１４−１８,0157-61-7431,市区町村機関
株式会社石狩ゴルフ場,北海道石狩市八幡町高岡地蔵沢,0133-66-4111,ゴルフ場
北見市役所北見市留辺蘂総合支所　弓道館,北海道北見市留辺蘂町旭公園８７,0157-42-4074,市区町村機関
ＫＧセントラルフィットネスクラブ山鼻,北海道札幌市中央区南２２条西１２丁目１−１,011-512-2220,スイミングスクール
スポーツクラブＺｉｐ琴似,北海道札幌市西区琴似１条４丁目４−１３,011-615-1212,ダンススクール、ダンス教室
札幌サッカースクール,北海道札幌市北区北３６条西３丁目３−８,011-747-1155,スポーツ教室
スリーエス（ＳＳＳ）札幌サッカースクール,北海道札幌市北区北３６条西３丁目３−８,011-747-1155,スポーツ教室
キックボクシングアカデミー　サッポロ,北海道札幌市中央区南７条西５丁目,011-522-9035,スポーツ教室
コナミスポーツクラブ新札幌,北海道札幌市厚別区厚別中央２条４丁目６,011-891-6033,スポーツ教室
岩見沢市役所　栗沢テニスコート・栗沢パークゴルフ場,北海道岩見沢市栗沢町最上５４６,0126-45-4811,市区町村機関
スポーツクラブＮＡＳ札幌,北海道札幌市西区西町南６丁目１,0120-732860,スイミングスクール
美瑛町役場　美瑛町スポーツセンター,北海道上川郡美瑛町丸山１丁目１−９,0166-92-2025,市区町村機関
スポーツフィールドキャロットテニス・フットサル,北海道札幌市豊平区平岸６条１６丁目２−６５,011-815-2510,テニスコート
スポーツクラブジョイフィット平岡公園店,北海道札幌市清田区平岡公園東３丁目１−５,011-888-0588,スポーツクラブ
コナミスポーツクラブ白石,北海道札幌市白石区南郷通１丁目北２−１,011-861-1556,スポーツ教室
日本ブラジリアン柔術連盟ギムナシオン札幌,北海道札幌市東区北１１条東５丁目１−１２,011-712-1100,スポーツ教室
空手道水滸曾総本部丈夫塾,北海道札幌市東区北１１条東５丁目１−１２,011-712-1100,スポーツ教室
株式会社宮の森スポーツ,北海道札幌市中央区北３条西２７丁目１−１,011-641-8311,スポーツ教室
イトマンフィットネス宮の森,北海道札幌市中央区北３条西２７丁目１−１,011-613-3232,スポーツクラブ
テニスパークジョイ,北海道旭川市永山１条５丁目１−３９,0166-46-2567,スポーツ教室
大沼合同遊船株式会社,北海道亀田郡七飯町字大沼町１０２３−１,0138-67-2229,海運
株式会社和歌,北海道白老郡白老町末広町２丁目６−６,0144-82-4355,スポーツ施設
岩見沢市役所　北村プール,北海道岩見沢市北村中央４７２５,0126-56-2521,市区町村機関
安平町役場安平町スポーツセンター　せいこドーム,北海道勇払郡安平町早来北進１０２−５,0145-22-3944,市区町村機関
ディノスボウル室蘭,北海道室蘭市東町４丁目３１−３,0143-44-1151,ボウリング場
スポーツクラブＺｉｐ平岸,北海道札幌市豊平区平岸３条８丁目２−１,011-821-1212,スイミングスクール
クライミングジム・レインボークリフ,北海道札幌市白石区東札幌２条２丁目３−２６,011-817-5009,スポーツ施設
ルスツリゾートゴルフコース,北海道虻田郡留寿都村字泉川１３,0136-46-3111,ゴルフ場
フィットネスクラブキタミ,北海道北見市光西町１６９−３８,0157-23-6111,スイミングスクール
スポーツクラブジョイフィット札幌北,北海道札幌市北区太平１２条１丁目１−１,011-774-2619,スポーツ教室
スポーツクラブルネサンス札幌平岸,北海道札幌市豊平区平岸２条１１丁目３−７,011-815-6060,スイミングスクール
イトマンフィットネス札幌,北海道札幌市北区北７条西１丁目１−２２,011-727-8815,スイミングスクール
スポーツアカデミーシーナ,北海道旭川市永山３条１５丁目１−５,0166-49-4032,スポーツ教室
びじねす旅館・新川,北海道苫小牧市本町２丁目１−１,0144-35-1212,ビジネスホテル
ノースリバーアドベンチャーズ,北海道空知郡南富良野町字落合１５５,0167-38-4150,スポーツ教室
スポーツクラブＺｉｐ麻生,北海道札幌市北区麻生町５丁目９−１５,011-728-1212,スイミングスクール
ルスツリゾート札幌営業所,北海道札幌市中央区北４条西４丁目,011-272-3111,ホテル
フィットネスクラブ・ソプラティコ,北海道小樽市花園４丁目１７−３,0134-22-3100,スポーツクラブ
フィットネスクラブソプラティコ,北海道小樽市花園４丁目１７−３,0134-24-0202,スポーツクラブ
浦臼国際ライフル射撃場,北海道樺戸郡浦臼町字浦臼内５８９−１,0125-67-3945,スポーツ施設
根室ゴルフクラブ,北海道根室市友知９３,0153-23-2964,ゴルフ場
ピアインドアテニススクール,北海道函館市富岡町３丁目２３−４,0138-42-0677,テニススクール
ラウンドワンスタジアム札幌北21条店,北海道札幌市東区北21条東1丁目1番21号,011-733-8801,スポーツ施設
スパビーチ,北海道北斗市七重浜８丁目４−１,0138-49-4411,ホテル
サンコーボウル,北海道札幌市西区琴似４条７丁目１−２０,011-641-5211,ボウリング場
綜合レジャーサンコーボウル,北海道札幌市西区琴似４条７丁目１−２０,011-641-5211,ボウリング場
フジバッティングセンター,北海道千歳市北斗４丁目１−２６,0123-26-4000,スポーツ施設
フジ商工株式会社　フジバッティングセンター,北海道千歳市北斗４丁目１−２６,0123-26-4000,スポーツ施設
バッティングセンター永山,北海道旭川市永山５条７丁目１−２７,0166-47-1146,スポーツ施設
永山バッティングセンター,北海道旭川市永山５条７丁目１２７,0166-47-1146,スポーツ施設
ＧーＭＡボクシングジム,北海道札幌市手稲区前田６条１２丁目１−１,011-826-6433,スポーツ施設
ラウンドワンスタジアム札幌・白石本通店,北海道札幌市白石区本通16丁目北1番50号,011-865-8051,スポーツ施設
スポーツセンター,北海道岩見沢市総合公園４０,0126-22-6240,市区町村機関
岩見沢市役所　スポーツセンター,北海道岩見沢市総合公園４０,0126-22-6240,市区町村機関
レッツスポーツクラブ,北海道函館市亀田中野町３３５−１,0138-47-0255,学習塾、進学教室
ホリデイスポーツクラブ　札幌清田店,北海道札幌市清田区北野４条５丁目７−２０,011-888-4000,スポーツクラブ
バッティングセンター東光,北海道旭川市東光９条２丁目４−１３,0166-33-7515,スポーツ施設
ニセコゴルフ＆リゾート,北海道磯谷郡蘭越町字栄４６−１,0136-56-2121,ゴルフ場
早来カントリー倶楽部,北海道勇払郡安平町早来新栄６７１−１,0145-22-3010,ゴルフ場
つどーむ,北海道札幌市東区栄町８８５−１,011-784-2106,サッカー場
きたえーる,北海道札幌市豊平区豊平５条１１丁目１−１,011-820-1703,スポーツ施設
川下公園バッティングセンター,北海道札幌市白石区川下２６８４１,01-1871-5185,スポーツ施設
川下公園バッティングセンター,北海道札幌市白石区川下２６８４−１,011-871-5185,スポーツ施設
エーヴランドゴルフクラブ,北海道余市郡余市町登町2361-1,0135-22-0011,ゴルフ場
エーヴランドゴルフクラブ,北海道余市郡余市町登町2361-1,0120-553941,ゴルフ場
道立野幌総合運動公園事務所,北海道江別市西野幌４８１,011-384-2166,都道府県機関
大倉山ジャンプ競技場総合案内所,北海道札幌市中央区宮の森１２７４,011-641-8585,スポーツ施設
サンヒルズサライ,北海道樺戸郡新十津川町字総進１８８−５,0125-76-3000,市区町村機関
新十津川町役場　サンヒルズサライ,北海道樺戸郡新十津川町字総進１８８−５,0125-76-3000,市区町村機関
ライディングヒルズ静内,北海道日高郡新ひだか町静内真歌７−１,0146-42-1131,市区町村機関
